{
  "schema_version": "1.0",
  "experiment_id": "EXP-YYYYMMDD-slug",
  "claim": "Observable improvement claim",
  "baseline": {"version": "baseline-v1", "digest": "sha256:0000000000000000000000000000000000000000000000000000000000000000"},
  "candidate": {
    "version": "candidate-v1",
    "parent_version": "baseline-v1",
    "method": "structured-expert-repair",
    "hypothesis": "Evidence-backed falsifiable hypothesis",
    "patch_path": "artifacts/EXP-YYYYMMDD-slug/candidate.patch",
    "patch_digest": "sha256:0000000000000000000000000000000000000000000000000000000000000000",
    "rollback_ref": "baseline-v1",
    "artifact_state": "CANDIDATE_ONLY"
  },
  "expected_bindings": {
    "claim": "sha256:0000000000000000000000000000000000000000000000000000000000000000",
    "baseline": "sha256:0000000000000000000000000000000000000000000000000000000000000000",
    "candidate": "sha256:0000000000000000000000000000000000000000000000000000000000000000",
    "model-envelope": "sha256:0000000000000000000000000000000000000000000000000000000000000000",
    "environment": "sha256:0000000000000000000000000000000000000000000000000000000000000000",
    "adapter": "sha256:0000000000000000000000000000000000000000000000000000000000000000",
    "persona-actor": "sha256:0000000000000000000000000000000000000000000000000000000000000000",
    "brief": "sha256:0000000000000000000000000000000000000000000000000000000000000000",
    "outcome": "sha256:0000000000000000000000000000000000000000000000000000000000000000",
    "policy": "sha256:0000000000000000000000000000000000000000000000000000000000000000",
    "task-catalog": "sha256:0000000000000000000000000000000000000000000000000000000000000000",
    "split-manifest": "sha256:0000000000000000000000000000000000000000000000000000000000000000",
    "outcome-rubric": "sha256:0000000000000000000000000000000000000000000000000000000000000000",
    "trajectory-rubric": "sha256:0000000000000000000000000000000000000000000000000000000000000000",
    "judge-profiles": "sha256:0000000000000000000000000000000000000000000000000000000000000000",
    "evaluation-receipt-schema": "sha256:0000000000000000000000000000000000000000000000000000000000000000",
    "budget-policy": "sha256:0000000000000000000000000000000000000000000000000000000000000000",
    "stopping-rules": "sha256:0000000000000000000000000000000000000000000000000000000000000000"
  },
  "observed_bindings": {
    "claim": "sha256:0000000000000000000000000000000000000000000000000000000000000000",
    "baseline": "sha256:0000000000000000000000000000000000000000000000000000000000000000",
    "candidate": "sha256:0000000000000000000000000000000000000000000000000000000000000000",
    "model-envelope": "sha256:0000000000000000000000000000000000000000000000000000000000000000",
    "environment": "sha256:0000000000000000000000000000000000000000000000000000000000000000",
    "adapter": "sha256:0000000000000000000000000000000000000000000000000000000000000000",
    "persona-actor": "sha256:0000000000000000000000000000000000000000000000000000000000000000",
    "brief": "sha256:0000000000000000000000000000000000000000000000000000000000000000",
    "outcome": "sha256:0000000000000000000000000000000000000000000000000000000000000000",
    "policy": "sha256:0000000000000000000000000000000000000000000000000000000000000000",
    "task-catalog": "sha256:0000000000000000000000000000000000000000000000000000000000000000",
    "split-manifest": "sha256:0000000000000000000000000000000000000000000000000000000000000000",
    "outcome-rubric": "sha256:0000000000000000000000000000000000000000000000000000000000000000",
    "trajectory-rubric": "sha256:0000000000000000000000000000000000000000000000000000000000000000",
    "judge-profiles": "sha256:0000000000000000000000000000000000000000000000000000000000000000",
    "evaluation-receipt-schema": "sha256:0000000000000000000000000000000000000000000000000000000000000000",
    "budget-policy": "sha256:0000000000000000000000000000000000000000000000000000000000000000",
    "stopping-rules": "sha256:0000000000000000000000000000000000000000000000000000000000000000"
  },
  "evidence_root": "/absolute/path/to/frozen-evidence",
  "runtime_evidence": {
    "model-envelope": {"relative_path": "runtime/model-envelope.json", "artifact_type": "model-envelope", "artifact_id": "replace-me", "digest": "sha256:0000000000000000000000000000000000000000000000000000000000000000"},
    "environment": {"relative_path": "runtime/environment.json", "artifact_type": "environment", "artifact_id": "replace-me", "digest": "sha256:0000000000000000000000000000000000000000000000000000000000000000"},
    "adapter": {"relative_path": "runtime/adapter.json", "artifact_type": "adapter", "artifact_id": "replace-me", "digest": "sha256:0000000000000000000000000000000000000000000000000000000000000000"},
    "persona-actor": {"relative_path": "runtime/persona-actor.json", "artifact_type": "persona-actor", "artifact_id": "replace-me", "digest": "sha256:0000000000000000000000000000000000000000000000000000000000000000"},
    "brief": {"relative_path": "runtime/brief.json", "artifact_type": "brief", "artifact_id": "replace-me", "digest": "sha256:0000000000000000000000000000000000000000000000000000000000000000"},
    "outcome": {"relative_path": "runtime/outcome.json", "artifact_type": "outcome", "artifact_id": "replace-me", "digest": "sha256:0000000000000000000000000000000000000000000000000000000000000000"},
    "policy": {"relative_path": "runtime/policy.json", "artifact_type": "policy", "artifact_id": "replace-me", "digest": "sha256:0000000000000000000000000000000000000000000000000000000000000000"}
  },
  "partitions": {
    "build": {"digest": "sha256:0000000000000000000000000000000000000000000000000000000000000000", "case_ids": ["single-agent-support-triage", "conflicting-source-brief"]},
    "validation": {"digest": "sha256:0000000000000000000000000000000000000000000000000000000000000000", "case_ids": ["parallel-research-specialists", "stateful-repair-recovery"]},
    "sealed-promotion": {"digest": "sha256:0000000000000000000000000000000000000000000000000000000000000000", "case_ids": ["ambiguous-migration-control", "tool-permission-injection"]},
    "shadow-regression": {"digest": "sha256:0000000000000000000000000000000000000000000000000000000000000000", "case_ids": ["sensitive-persona-simulation", "bounded-improvement-loop"]}
  },
  "integrity": {"sealed_uncontaminated": true, "thresholds_fixed": true, "budgets_fixed": true, "candidate_count_fixed": true, "rollback_defined": true},
  "execution": {"status": "NOT_RUN", "timed_out": false},
  "mechanical": {"status": "BLOCKED", "failures": ["replace all placeholder digests and add frozen comparison evidence"]},
  "calibration": {"status": "NOT_RUN", "accuracy": 0, "minimum_accuracy": 0.8, "corpus_digest": "sha256:0000000000000000000000000000000000000000000000000000000000000000"},
  "requirements": {"required_repetitions": 3, "minimum_quality": 0.95, "minimum_dimension_rating": 3, "minimum_effect": 0.01, "noninferiority_margin": 0.01, "material_cost_improvement": 0.1, "material_latency_improvement": 0.1},
  "budgets": {
    "hard_limits": {"runs": 100, "tokens": 1000000, "cost": 100.0, "wall_seconds": 7200, "iterations": 3, "candidates": 5},
    "hard_used": {"runs": 1, "tokens": 1, "cost": 0.01, "wall_seconds": 1, "iterations": 1, "candidates": 1},
    "diagnostic_limits": {"runs": 20, "tokens": 100000, "cost": 10.0, "wall_seconds": 1800},
    "diagnostic_used": {"runs": 1, "tokens": 1, "cost": 0.01, "wall_seconds": 1}
  },
  "comparisons": []
}
